{
  "schema_version": "2.0-proposal",
  "artifact_kind": "design_fixture",
  "activation_allowed": false,
  "created_on": "2026-10-13",
  "timezone": "Asia/Ho_Chi_Minh",
  "sample_id": "proposal-0e52a2ae30165ae5",
  "source_sha256": {
    "data/documents.json": "15a30693de30220cae171864a6385a842e194139365d92c4ec43b18845dab728",
    "data/organization.json": "08348a2e777662e1e7544e043db2ddb8b3c7995a1717995928822ff5076ef88e",
    "data/personas.json": "12cdde6b298d685dc093b12450eb2397f669ab1ceb0a65d47563312bb6b8e4f2"
  },
  "migration_decisions": [
    {
      "id": "M01",
      "status": "proposed",
      "description": "Đề xuất valid_to exclusive 2026-03-01 cho A v1; owner xác nhận trước migration.",
      "owner": null,
      "evidence": null
    },
    {
      "id": "M02",
      "status": "proposed",
      "description": "10 ngày báo trước của Team chưa rõ working/calendar; giữ unspecified_days.",
      "owner": null,
      "evidence": null
    },
    {
      "id": "M03",
      "status": "proposed",
      "description": "Chuyển sentinel 99 thành unlimited/null trong mẫu; cần owner xác nhận.",
      "owner": null,
      "evidence": null
    },
    {
      "id": "M04",
      "status": "proposed",
      "description": "Approval events là synthetic proposal, chưa có bằng chứng lịch sử thật.",
      "owner": null,
      "evidence": null
    },
    {
      "id": "M05",
      "status": "proposed",
      "description": "Quyền preview Draft HR phải tách khỏi quyền trả lời chính sách.",
      "owner": null,
      "evidence": null
    },
    {
      "id": "M06",
      "status": "proposed",
      "description": "ACL Executive và audience được hưởng chính sách cần owner xác nhận.",
      "owner": null,
      "evidence": null
    }
  ],
  "organization": [
    {
      "id": "GRP",
      "name": "Tập đoàn Alpha",
      "level": "Group",
      "parent": null
    },
    {
      "id": "CTY_A",
      "name": "Công ty A (Alpha Media)",
      "level": "Company",
      "parent": "GRP"
    },
    {
      "id": "CTY_B",
      "name": "Công ty B (Alpha Pay)",
      "level": "Company",
      "parent": "GRP"
    },
    {
      "id": "DEPT_MKT_A",
      "name": "Phòng Marketing (Cty A)",
      "level": "Department",
      "parent": "CTY_A"
    },
    {
      "id": "DEPT_HR_A",
      "name": "Phòng Nhân sự (Cty A)",
      "level": "Department",
      "parent": "CTY_A"
    },
    {
      "id": "DEPT_ENG_B",
      "name": "Phòng Kỹ thuật (Cty B)",
      "level": "Department",
      "parent": "CTY_B"
    },
    {
      "id": "DEPT_OPS_B",
      "name": "Phòng Vận hành (Cty B)",
      "level": "Department",
      "parent": "CTY_B"
    },
    {
      "id": "TEAM_PAY_B",
      "name": "Nhóm Payments On-call (PB Kỹ thuật, Cty B)",
      "level": "Team",
      "parent": "DEPT_ENG_B"
    }
  ],
  "personas": [
    {
      "user_id": "lan",
      "name": "Lan",
      "company": "CTY_A",
      "department": "DEPT_MKT_A",
      "team": null,
      "role": "Staff",
      "contract_type": "Official",
      "description": "Nhân viên chính thức, Marketing, Công ty A"
    },
    {
      "user_id": "hung",
      "name": "Hùng",
      "company": "CTY_B",
      "department": "DEPT_ENG_B",
      "team": "TEAM_PAY_B",
      "role": "TeamLead",
      "contract_type": "Official",
      "description": "Trưởng nhóm Payments On-call, PB Kỹ thuật, Công ty B"
    },
    {
      "user_id": "mai",
      "name": "Mai",
      "company": "CTY_A",
      "department": "DEPT_HR_A",
      "team": null,
      "role": "HR_Admin",
      "contract_type": "Official",
      "description": "HR Admin, PB Nhân sự, Công ty A"
    },
    {
      "user_id": "nam",
      "name": "Nam",
      "company": "CTY_A",
      "department": "DEPT_MKT_A",
      "team": null,
      "role": "Contractor",
      "contract_type": "Contractor",
      "description": "Nhà thầu / Cộng tác viên, Marketing, Công ty A"
    }
  ],
  "documents": [
    {
      "doc_uid": "POL-GRP-LV@v3.0",
      "policy_id": "POL-GRP-LV",
      "version": "v3.0",
      "title": "Chính sách nghỉ phép Tập đoàn Alpha",
      "topic": "annual_leave",
      "scope": {
        "unit_id": "GRP",
        "level": "Group"
      },
      "lifecycle": {
        "state": "Approved",
        "valid_from": "2026-01-01",
        "valid_to": null,
        "events": [
          {
            "event": "approved",
            "at": "2026-01-01",
            "evidence_type": "synthetic_proposal"
          }
        ],
        "history_evidence": "synthetic_proposal"
      },
      "access": {
        "classification": "Internal",
        "allowed_roles": [],
        "applies_to": [
          "Official"
        ],
        "audience_roles": [],
        "deny_on_missing": true
      },
      "governance": {
        "owner_id": "HR_Group",
        "review_due": null,
        "review_state": "needs_owner_review"
      },
      "provenance": {
        "source_path": "data/documents.json",
        "line_start": 2,
        "line_end": 27,
        "sha256": "15a30693de30220cae171864a6385a842e194139365d92c4ec43b18845dab728",
        "source_type": "mock_json"
      },
      "supersedes": [],
      "clauses": [
        {
          "clause_id": "POL-GRP-LV@v3.0#entitlement",
          "key": "entitlement",
          "label": "Số ngày nghỉ",
          "text_source": "Nhân sự chính thức toàn Tập đoàn được hưởng tối thiểu 12 ngày phép năm có hưởng lương.",
          "typed_value": {
            "kind": "number",
            "value": 12,
            "unit": "annual_paid_days"
          },
          "render_template": "{value} ngày phép/năm",
          "is_floor": true,
          "comparison": "minimum",
          "source_ref": {
            "path": "data/documents.json",
            "line": 17,
            "json_pointer": "/0/clauses/entitlement"
          },
          "review_flags": []
        },
        {
          "clause_id": "POL-GRP-LV@v3.0#notice_period",
          "key": "notice_period",
          "label": "Thời hạn báo trước",
          "text_source": "Thời gian thông báo nghỉ phép tối thiểu là 2 ngày làm việc.",
          "typed_value": {
            "kind": "number",
            "value": 2,
            "unit": "business_days"
          },
          "render_template": "{value} ngày làm việc",
          "is_floor": false,
          "comparison": "none",
          "source_ref": {
            "path": "data/documents.json",
            "line": 22,
            "json_pointer": "/0/clauses/notice_period"
          },
          "review_flags": []
        }
      ]
    },
    {
      "doc_uid": "POL-A-LV@v1.0",
      "policy_id": "POL-A-LV",
      "version": "v1.0",
      "title": "Quy chế nghỉ phép Công ty A (Cũ)",
      "topic": "annual_leave",
      "scope": {
        "unit_id": "CTY_A",
        "level": "Company"
      },
      "lifecycle": {
        "state": "Superseded",
        "valid_from": "2024-01-01",
        "valid_to": "2026-03-01",
        "events": [
          {
            "event": "approved",
            "at": "2024-01-01",
            "evidence_type": "synthetic_proposal"
          },
          {
            "event": "superseded",
            "at": "2026-03-01",
            "evidence_type": "synthetic_proposal"
          }
        ],
        "history_evidence": "synthetic_proposal"
      },
      "access": {
        "classification": "Internal",
        "allowed_roles": [],
        "applies_to": [
          "Official"
        ],
        "audience_roles": [],
        "deny_on_missing": true
      },
      "governance": {
        "owner_id": "HR_A",
        "review_due": null,
        "review_state": "needs_owner_review"
      },
      "provenance": {
        "source_path": "data/documents.json",
        "line_start": 28,
        "line_end": 52,
        "sha256": "15a30693de30220cae171864a6385a842e194139365d92c4ec43b18845dab728",
        "source_type": "mock_json"
      },
      "supersedes": [],
      "clauses": [
        {
          "clause_id": "POL-A-LV@v1.0#entitlement",
          "key": "entitlement",
          "label": "Số ngày nghỉ",
          "text_source": "Nhân viên Công ty A được nghỉ 12 ngày phép/năm.",
          "typed_value": {
            "kind": "number",
            "value": 12,
            "unit": "annual_paid_days"
          },
          "render_template": "{value} ngày phép/năm",
          "is_floor": false,
          "comparison": "none",
          "source_ref": {
            "path": "data/documents.json",
            "line": 43,
            "json_pointer": "/1/clauses/entitlement"
          },
          "review_flags": []
        },
        {
          "clause_id": "POL-A-LV@v1.0#notice_period",
          "key": "notice_period",
          "label": "Thời hạn báo trước",
          "text_source": "Thông báo trước tối thiểu 3 ngày làm việc.",
          "typed_value": {
            "kind": "number",
            "value": 3,
            "unit": "business_days"
          },
          "render_template": "{value} ngày làm việc",
          "is_floor": false,
          "comparison": "none",
          "source_ref": {
            "path": "data/documents.json",
            "line": 47,
            "json_pointer": "/1/clauses/notice_period"
          },
          "review_flags": []
        }
      ]
    },
    {
      "doc_uid": "POL-A-LV@v2.0",
      "policy_id": "POL-A-LV",
      "version": "v2.0",
      "title": "Quy chế nghỉ phép Công ty A (Mới)",
      "topic": "annual_leave",
      "scope": {
        "unit_id": "CTY_A",
        "level": "Company"
      },
      "lifecycle": {
        "state": "Approved",
        "valid_from": "2026-03-01",
        "valid_to": null,
        "events": [
          {
            "event": "approved",
            "at": "2026-03-01",
            "evidence_type": "synthetic_proposal"
          }
        ],
        "history_evidence": "synthetic_proposal"
      },
      "access": {
        "classification": "Internal",
        "allowed_roles": [],
        "applies_to": [
          "Official"
        ],